{
  "meta": {
    "id": "rainbow",
    "name": "Rainbow Road",
    "nameJa": "レインボーロード",
    "theme": "rainbow",
    "difficulty": "expert",
    "laps": 3,
    "thumbnail": "/images/courses/rainbow_thumb.png",
    "description": "The legendary Rainbow Road in space! Race on a glowing rainbow track above the cosmos. No walls - one wrong move and you'll fall into the stars!"
  },
  "track": {
    "width": 18,
    "hasWalls": false,
    "waypoints": [
      { "x": 0, "y": 50, "z": -200, "width": 20 },
      { "x": 60, "y": 52, "z": -180, "width": 18 },
      { "x": 100, "y": 55, "z": -140, "width": 18 },
      { "x": 120, "y": 60, "z": -80, "width": 16 },
      { "x": 130, "y": 65, "z": -20, "width": 16 },
      { "x": 120, "y": 70, "z": 40, "width": 16 },
      { "x": 90, "y": 75, "z": 90, "width": 16 },
      { "x": 40, "y": 80, "z": 130, "width": 18 },
      { "x": -30, "y": 85, "z": 150, "width": 18 },
      { "x": -100, "y": 80, "z": 140, "width": 16 },
      { "x": -150, "y": 70, "z": 100, "width": 14 },
      { "x": -170, "y": 60, "z": 40, "width": 14 },
      { "x": -160, "y": 55, "z": -30, "width": 16 },
      { "x": -130, "y": 52, "z": -90, "width": 18 },
      { "x": -80, "y": 50, "z": -140, "width": 18 },
      { "x": -40, "y": 50, "z": -180, "width": 20 }
    ],
    "finishLine": {
      "waypointIndex": 0,
      "direction": "x",
      "position": { "x": 0, "y": 50, "z": -200 }
    }
  },
  "features": {
    "itemBoxes": [
      { "position": { "x": 80, "y": 55, "z": -160 } },
      { "position": { "x": 125, "y": 63, "z": -50 } },
      { "position": { "x": 115, "y": 68, "z": 15 } },
      { "position": { "x": 65, "y": 78, "z": 110 } },
      { "position": { "x": 5, "y": 83, "z": 145 } },
      { "position": { "x": -65, "y": 82, "z": 145 } },
      { "position": { "x": -125, "y": 75, "z": 120 } },
      { "position": { "x": -165, "y": 65, "z": 70 } },
      { "position": { "x": -165, "y": 57, "z": 5 } },
      { "position": { "x": -145, "y": 53, "z": -65 } },
      { "position": { "x": -105, "y": 51, "z": -115 } },
      { "position": { "x": -60, "y": 50, "z": -160 } }
    ],
    "starRings": [
      { "position": { "x": 110, "y": 57, "z": -110 }, "rotation": 45 },
      { "position": { "x": 105, "y": 72, "z": 65 }, "rotation": -30 },
      { "position": { "x": -15, "y": 82, "z": 148 }, "rotation": 180 },
      { "position": { "x": -125, "y": 67, "z": 70 }, "rotation": 90 },
      { "position": { "x": -145, "y": 53, "z": -60 }, "rotation": -45 }
    ]
  },
  "startingGrid": {
    "positions": [
      { "x": 0, "y": 50, "z": -220, "rotation": 0 },
      { "x": -8, "y": 50, "z": -225, "rotation": 0 },
      { "x": 8, "y": 50, "z": -225, "rotation": 0 },
      { "x": -16, "y": 50, "z": -230, "rotation": 0 },
      { "x": 16, "y": 50, "z": -230, "rotation": 0 },
      { "x": -24, "y": 50, "z": -235, "rotation": 0 },
      { "x": 24, "y": 50, "z": -235, "rotation": 0 },
      { "x": 0, "y": 50, "z": -240, "rotation": 0 }
    ]
  },
  "ai": {
    "difficulty": "expert",
    "maxSpeedMultiplier": 1.25,
    "reactionTime": 0.08,
    "turnAccuracy": 0.95,
    "itemUseProbability": 0.9,
    "rubberBandStrength": 0.7,
    "mistakeProbability": 0.03
  },
  "courseSpecific": {
    "spaceTheme": true,
    "fallOffTrack": true,
    "respawnHeight": 45,
    "starField": true,
    "ambientEffects": ["stars", "nebula", "sparkles"]
  }
}